{
   "name": "CompensationStructure",
   "namespace": "sap.sf.foundationobjects",
   "title": "CompensationStructure",
   "shortDescription": "Comp structure refers to component of comp information and their definition.",
   "description": "Compensation structure refers to components of compensation information and their definitions.",
   "version": "1.0.0",
   "extensible": {
      "supported": "automatic",
      "description": "Extensions to the model are automatically integrated in the API"
   },
   "hdlfsSchemas": [
      {
         "name": "CompensationStructure",
         "shareTables": [
            {
               "name": "payComponentGroup_payComponent",
               "version": "1.0.0",
               "medallionLayer": "silver"
            },
            {
               "name": "payComponentGroup_payComponentGroupTimeslice",
               "version": "1.0.0",
               "medallionLayer": "silver"
            },
            {
               "name": "payComponentGroup",
               "version": "1.0.0",
               "medallionLayer": "silver"
            },
            {
               "name": "payComponentGroup_payComponentGroupTimesliceText",
               "version": "1.0.0",
               "medallionLayer": "silver"
            },
            {
               "name": "payComponent_payComponentTimesliceText",
               "version": "1.0.0",
               "medallionLayer": "silver"
            },
            {
               "name": "payComponent",
               "version": "1.0.0",
               "medallionLayer": "silver"
            },
            {
               "name": "payComponent_payComponentTimeslice",
               "version": "1.0.0",
               "medallionLayer": "silver"
            }
         ]
      }
   ]
}