{
   "name": "RelatedPersons",
   "namespace": "sap.sf.workforce",
   "title": "RelatedPersons",
   "shortDescription": "A related person represent person related to or financially reliant on employee, such as a spouse or child.",
   "description": "A related person represents persons related to or financially reliant on an employee, such as a spouse or child.",
   "version": "1.0.0",
   "extensible": {
      "supported": "automatic",
      "description": "Extensions to the model are automatically integrated in the API"
   },
   "hdlfsSchemas": [
      {
         "name": "RelatedPersons",
         "shareTables": [
            {
               "name": "dependent_dependentPersonalDetail",
               "version": "1.0.0",
               "medallionLayer": "silver"
            },
            {
               "name": "dependent_dependentBiographicalDetail",
               "version": "1.0.0",
               "medallionLayer": "silver"
            },
            {
               "name": "dependent_personRelationship",
               "version": "1.0.0",
               "medallionLayer": "silver"
            },
            {
               "name": "dependent",
               "version": "1.0.0",
               "medallionLayer": "silver"
            }
         ]
      }
   ]
}