{
   "name": "EnterpriseStructure",
   "namespace": "sap.sf.foundationobjects",
   "title": "EnterpriseStructure",
   "shortDescription": "Ent structure is info about a company structure relevant for employee. It includes data such as legal entity, location group, location, and cost center.",
   "description": "Enterprise structure is information about a company's structure relevant for employees. It includes data such as legal entity, location group, location, and cost center.",
   "version": "1.0.0",
   "extensible": {
      "supported": "automatic",
      "description": "Extensions to the model are automatically integrated in the API"
   },
   "hdlfsSchemas": [
      {
         "name": "EnterpriseStructure",
         "shareTables": [
            {
               "name": "legalEntity_LegalEntityBOL",
               "version": "1.0.0",
               "medallionLayer": "silver"
            },
            {
               "name": "legalEntity_legalEntityText",
               "version": "1.0.0",
               "medallionLayer": "silver"
            },
            {
               "name": "legalEntity_LegalEntitySVN",
               "version": "1.0.0",
               "medallionLayer": "silver"
            },
            {
               "name": "legalEntity_legalEntityTimeSlice",
               "version": "1.0.0",
               "medallionLayer": "silver"
            },
            {
               "name": "legalEntity_LegalEntityTHA",
               "version": "1.0.0",
               "medallionLayer": "silver"
            },
            {
               "name": "legalEntity",
               "version": "1.0.0",
               "medallionLayer": "silver"
            },
            {
               "name": "legalEntity_LegalEntityUSA",
               "version": "1.0.0",
               "medallionLayer": "silver"
            },
            {
               "name": "legalEntity_LegalEntityTUN",
               "version": "1.0.0",
               "medallionLayer": "silver"
            },
            {
               "name": "legalEntity_LegalEntityBLR",
               "version": "1.0.0",
               "medallionLayer": "silver"
            },
            {
               "name": "legalEntity_LegalEntityARG",
               "version": "1.0.0",
               "medallionLayer": "silver"
            },
            {
               "name": "legalEntity_LegalEntityRUS",
               "version": "1.0.0",
               "medallionLayer": "silver"
            },
            {
               "name": "legalEntity_LegalEntitySGP",
               "version": "1.0.0",
               "medallionLayer": "silver"
            },
            {
               "name": "legalEntity_LegalEntitySAU",
               "version": "1.0.0",
               "medallionLayer": "silver"
            },
            {
               "name": "legalEntity_LegalEntityDEU",
               "version": "1.0.0",
               "medallionLayer": "silver"
            },
            {
               "name": "legalEntity_LegalEntityCAN",
               "version": "1.0.0",
               "medallionLayer": "silver"
            },
            {
               "name": "legalEntity_LegalEntityFRA",
               "version": "1.0.0",
               "medallionLayer": "silver"
            },
            {
               "name": "legalEntity_LegalEntityESP",
               "version": "1.0.0",
               "medallionLayer": "silver"
            },
            {
               "name": "legalEntity_LegalEntityPRY",
               "version": "1.0.0",
               "medallionLayer": "silver"
            },
            {
               "name": "locationGroup",
               "version": "1.0.0",
               "medallionLayer": "silver"
            },
            {
               "name": "locationGroup_locationGroupTimesliceText",
               "version": "1.0.0",
               "medallionLayer": "silver"
            },
            {
               "name": "locationGroup_locationGroupTimeslice",
               "version": "1.0.0",
               "medallionLayer": "silver"
            },
            {
               "name": "location_legalEntity",
               "version": "1.0.0",
               "medallionLayer": "silver"
            },
            {
               "name": "location_locationTimesliceText",
               "version": "1.0.0",
               "medallionLayer": "silver"
            },
            {
               "name": "location_locationTimeslice",
               "version": "1.0.0",
               "medallionLayer": "silver"
            },
            {
               "name": "location_addressInformation",
               "version": "1.0.0",
               "medallionLayer": "silver"
            },
            {
               "name": "location",
               "version": "1.0.0",
               "medallionLayer": "silver"
            },
            {
               "name": "location_LegalEntity",
               "version": "1.0.0",
               "medallionLayer": "silver"
            },
            {
               "name": "costCenter_legalEntity",
               "version": "1.0.0",
               "medallionLayer": "silver"
            },
            {
               "name": "costCenter",
               "version": "1.0.0",
               "medallionLayer": "silver"
            },
            {
               "name": "costCenter_costCenterTimeSlice",
               "version": "1.0.0",
               "medallionLayer": "silver"
            },
            {
               "name": "costCenter_costCenterText",
               "version": "1.0.0",
               "medallionLayer": "silver"
            }
         ]
      }
   ]
}