{
   "name": "LearningHistory",
   "namespace": "sap.sf.learning",
   "title": "LearningHistory",
   "shortDescription": "Learning History includes the information of all completions including courses and programs",
   "description": "Learning History includes information of all completions including courses, programs[User Data]",
   "version": "1.0.0",
   "extensible": {
      "supported": "automatic",
      "description": "Extensions to the model are automatically integrated in the API"
   },
   "hdlfsSchemas": [
      {
         "name": "LearningHistory",
         "shareTables": [
            {
               "name": "learningCompletion",
               "version": "1.0.0",
               "medallionLayer": "silver"
            }
         ]
      }
   ]
}