{
   "name": "PayStructure",
   "namespace": "sap.sf.foundationobjects",
   "title": "PayStructure",
   "shortDescription": "Pay structure refer to the payment defn, including pay range, pay grade, and pay scale type.",
   "description": "Pay structure refers to the payment definition, including pay range, pay grade, and pay scale types.",
   "version": "1.0.0",
   "extensible": {
      "supported": "automatic",
      "description": "Extensions to the model are automatically integrated in the API"
   },
   "hdlfsSchemas": [
      {
         "name": "PayStructure",
         "shareTables": [
            {
               "name": "payScaleType_payScaleTypeText",
               "version": "1.0.0",
               "medallionLayer": "silver"
            },
            {
               "name": "payScaleType",
               "version": "1.0.0",
               "medallionLayer": "silver"
            },
            {
               "name": "payScaleGroup_payScaleGroupText",
               "version": "1.0.0",
               "medallionLayer": "silver"
            },
            {
               "name": "payScaleGroup",
               "version": "1.0.0",
               "medallionLayer": "silver"
            },
            {
               "name": "payScaleArea",
               "version": "1.0.0",
               "medallionLayer": "silver"
            },
            {
               "name": "payScaleArea_payScaleAreaText",
               "version": "1.0.0",
               "medallionLayer": "silver"
            },
            {
               "name": "payScaleLevel_payScaleLevelText",
               "version": "1.0.0",
               "medallionLayer": "silver"
            },
            {
               "name": "payScaleLevel",
               "version": "1.0.0",
               "medallionLayer": "silver"
            },
            {
               "name": "payScaleLevel_PayScalePayComponent",
               "version": "1.0.0",
               "medallionLayer": "silver"
            },
            {
               "name": "payScaleLevel_payScaleLevelTimeSlice",
               "version": "1.0.0",
               "medallionLayer": "silver"
            },
            {
               "name": "payGrade",
               "version": "1.0.0",
               "medallionLayer": "silver"
            },
            {
               "name": "payGrade_payGradeTimesliceText",
               "version": "1.0.0",
               "medallionLayer": "silver"
            },
            {
               "name": "payGrade_payGradeTimeslice",
               "version": "1.0.0",
               "medallionLayer": "silver"
            },
            {
               "name": "payRange",
               "version": "1.0.0",
               "medallionLayer": "silver"
            },
            {
               "name": "payRange_payRangeTimesliceText",
               "version": "1.0.0",
               "medallionLayer": "silver"
            },
            {
               "name": "payRange_payRangeTimeslice",
               "version": "1.0.0",
               "medallionLayer": "silver"
            }
         ]
      }
   ]
}