{
   "name": "Position",
   "namespace": "sap.sf.workforce",
   "title": "Position",
   "shortDescription": "Job position is the smallest unit of the org structure in a certain part of a company and comprises a specific occurrence of a job.",
   "description": "Job position is the smallest unit of the organizational structure in a certain part of a company and comprises a specific occurrence of a job with a fixed combination of tasks, competencies, and responsibilities.",
   "version": "1.0.0",
   "extensible": {
      "supported": "automatic",
      "description": "Extensions to the model are automatically integrated in the API"
   },
   "hdlfsSchemas": [
      {
         "name": "Position",
         "shareTables": [
            {
               "name": "position",
               "version": "1.0.0",
               "medallionLayer": "silver"
            },
            {
               "name": "position_positionText",
               "version": "1.0.0",
               "medallionLayer": "silver"
            },
            {
               "name": "position_PositionMatrixRelationship",
               "version": "1.0.0",
               "medallionLayer": "silver"
            },
            {
               "name": "position_positionTimeSlice",
               "version": "1.0.0",
               "medallionLayer": "silver"
            }
         ]
      }
   ]
}