{
   "name": "GrowthPortfolio",
   "namespace": "sap.sf.capabilities",
   "title": "GrowthPortfolio",
   "shortDescription": "Provides profile data of the employees with Skills and Attributes",
   "description": "This data product provides Profile data of employees with Skills and Attributes",
   "version": "1.0.0",
   "extensible": {
      "supported": "automatic",
      "description": "Extensions to the model are automatically integrated in the API"
   },
   "hdlfsSchemas": [
      {
         "name": "GrowthPortfolio",
         "shareTables": [
            {
               "name": "growthPortfolioAttribute",
               "version": "1.0.0",
               "medallionLayer": "silver"
            },
            {
               "name": "growthPortfolioAttribute_assessmentHistory",
               "version": "1.0.0",
               "medallionLayer": "silver"
            }
         ]
      }
   ]
}