{
   "name": "ContingentManagementData",
   "namespace": "sap.sf.workforce",
   "title": "ContingentManagementData",
   "shortDescription": "Contingent management includes info about contingent workers distributors who are entrusted with the staffing responsibilities in a company.",
   "description": "Contingent management data includes information about contingent workers's distributors who are entrusted with the staffing responsibilities in a company.",
   "version": "1.0.0",
   "extensible": {
      "supported": "automatic",
      "description": "Extensions to the model are automatically integrated in the API"
   },
   "hdlfsSchemas": [
      {
         "name": "ContingentManagementData",
         "shareTables": [
            {
               "name": "vendorInfo_vendorInfoText",
               "version": "1.0.0",
               "medallionLayer": "silver"
            },
            {
               "name": "vendorInfo_vendorInfoTimeSlice",
               "version": "1.0.0",
               "medallionLayer": "silver"
            },
            {
               "name": "vendorInfo",
               "version": "1.0.0",
               "medallionLayer": "silver"
            }
         ]
      }
   ]
}