{
   "name": "OrganizationalStructure",
   "namespace": "sap.sf.foundationobjects",
   "title": "OrganizationalStructure",
   "shortDescription": "Org structure refers to org and reporting structure in a company.",
   "description": "Organization structure refers to organizational and reporting structures in a company.",
   "version": "1.0.0",
   "extensible": {
      "supported": "automatic",
      "description": "Extensions to the model are automatically integrated in the API"
   },
   "hdlfsSchemas": [
      {
         "name": "OrganizationalStructure",
         "shareTables": [
            {
               "name": "businessUnit",
               "version": "1.0.0",
               "medallionLayer": "silver"
            },
            {
               "name": "businessUnit_businessUnitTimeSlice",
               "version": "1.0.0",
               "medallionLayer": "silver"
            },
            {
               "name": "businessUnit_businessUnitText",
               "version": "1.0.0",
               "medallionLayer": "silver"
            },
            {
               "name": "division_businessUnit",
               "version": "1.0.0",
               "medallionLayer": "silver"
            },
            {
               "name": "division",
               "version": "1.0.0",
               "medallionLayer": "silver"
            },
            {
               "name": "division_divisionTimeSlice",
               "version": "1.0.0",
               "medallionLayer": "silver"
            },
            {
               "name": "division_divisionText",
               "version": "1.0.0",
               "medallionLayer": "silver"
            },
            {
               "name": "department_DepartmentApprenticeDetail",
               "version": "1.0.0",
               "medallionLayer": "silver"
            },
            {
               "name": "department",
               "version": "1.0.0",
               "medallionLayer": "silver"
            },
            {
               "name": "department_division",
               "version": "1.0.0",
               "medallionLayer": "silver"
            },
            {
               "name": "department_departmentTimeSlice",
               "version": "1.0.0",
               "medallionLayer": "silver"
            },
            {
               "name": "department_departmentText",
               "version": "1.0.0",
               "medallionLayer": "silver"
            }
         ]
      }
   ]
}