{
   "name": "Picklist",
   "namespace": "sap.sf.extensibility",
   "title": "Picklist",
   "shortDescription": "All refer picklist, its needed in derived data product transform pipeline and data modelling for out- of- the-box content and Insight app",
   "description": "All referenced picklists, its needed in derived data product's transformation pipeline and data modelling for out- of- the-box content and Insight app.",
   "version": "1.0.0",
   "extensible": {
      "supported": "automatic",
      "description": "Extensions to the model are automatically integrated in the API"
   },
   "hdlfsSchemas": [
      {
         "name": "Picklist",
         "shareTables": [
            {
               "name": "pickList",
               "version": "1.0.0",
               "medallionLayer": "silver"
            },
            {
               "name": "pickList_pickListTimeSlice",
               "version": "1.0.0",
               "medallionLayer": "silver"
            },
            {
               "name": "pickList_pickListValue",
               "version": "1.0.0",
               "medallionLayer": "silver"
            },
            {
               "name": "pickList_pickListValueText",
               "version": "1.0.0",
               "medallionLayer": "silver"
            }
         ]
      }
   ]
}