{
   "name": "Course",
   "namespace": "sap.sf.learning",
   "title": "Course",
   "shortDescription": "Includes all information for an item.",
   "description": "Includes all the information for an item[Entity]",
   "version": "1.0.0",
   "extensible": {
      "supported": "automatic",
      "description": "Extensions to the model are automatically integrated in the API"
   },
   "hdlfsSchemas": [
      {
         "name": "Course",
         "shareTables": [
            {
               "name": "course_categories",
               "version": "1.0.0",
               "medallionLayer": "silver"
            },
            {
               "name": "course",
               "version": "1.0.0",
               "medallionLayer": "silver"
            },
            {
               "name": "course_courseText",
               "version": "1.0.0",
               "medallionLayer": "silver"
            },
            {
               "name": "course_capabilityRating",
               "version": "1.0.0",
               "medallionLayer": "silver"
            }
         ]
      }
   ]
}