{
   "name": "DeliveryMethod",
   "namespace": "sap.sf.learning",
   "title": "DeliveryMethod",
   "shortDescription": "Reference Data that is required in Learning. Delivery Date assumes that all the dependencies are in place.",
   "description": "Reference Data required in Learning.Delivery Date assumes that all dependencies are in place. If this is not the case then Delivery Qtr will be re-determined",
   "version": "1.0.0",
   "extensible": {
      "supported": "automatic",
      "description": "Extensions to the model are automatically integrated in the API"
   },
   "hdlfsSchemas": [
      {
         "name": "DeliveryMethod",
         "shareTables": [
            {
               "name": "deliveryMethod",
               "version": "1.0.0",
               "medallionLayer": "silver"
            },
            {
               "name": "deliveryMethod_deliveryMethodText",
               "version": "1.0.0",
               "medallionLayer": "silver"
            }
         ]
      }
   ]
}