{
   "name": "JobStructure",
   "namespace": "sap.sf.foundationobjects",
   "title": "JobStructure",
   "shortDescription": "Job structure refer to info about job classification and job function.",
   "description": "Job structure refers to information about job classication and job function.",
   "version": "1.0.0",
   "extensible": {
      "supported": "automatic",
      "description": "Extensions to the model are automatically integrated in the API"
   },
   "hdlfsSchemas": [
      {
         "name": "JobStructure",
         "shareTables": [
            {
               "name": "jobClassification_JobClassificationCHL",
               "version": "1.0.0",
               "medallionLayer": "silver"
            },
            {
               "name": "jobClassification",
               "version": "1.0.0",
               "medallionLayer": "silver"
            },
            {
               "name": "jobClassification_JobClassificationBOL",
               "version": "1.0.0",
               "medallionLayer": "silver"
            },
            {
               "name": "jobClassification_JobClassificationAUS",
               "version": "1.0.0",
               "medallionLayer": "silver"
            },
            {
               "name": "jobClassification_JobClassificationCAN",
               "version": "1.0.0",
               "medallionLayer": "silver"
            },
            {
               "name": "jobClassification_JobClassificationBRA",
               "version": "1.0.0",
               "medallionLayer": "silver"
            },
            {
               "name": "jobClassification_JobClassificationZAF",
               "version": "1.0.0",
               "medallionLayer": "silver"
            },
            {
               "name": "jobClassification_JobClassificationUSA",
               "version": "1.0.0",
               "medallionLayer": "silver"
            },
            {
               "name": "jobClassification_JobClassificationFRA",
               "version": "1.0.0",
               "medallionLayer": "silver"
            },
            {
               "name": "jobClassification_JobClassificationCountry",
               "version": "1.0.0",
               "medallionLayer": "silver"
            },
            {
               "name": "jobClassification_JobClassificationITA",
               "version": "1.0.0",
               "medallionLayer": "silver"
            },
            {
               "name": "jobClassification_JobClassificationGBR",
               "version": "1.0.0",
               "medallionLayer": "silver"
            },
            {
               "name": "jobClassification_jobClassificationTimeSlice",
               "version": "1.0.0",
               "medallionLayer": "silver"
            },
            {
               "name": "jobClassification_jobClassificationText",
               "version": "1.0.0",
               "medallionLayer": "silver"
            },
            {
               "name": "jobFunction",
               "version": "1.0.0",
               "medallionLayer": "silver"
            },
            {
               "name": "jobFunction_jobFunctionTimeSlice",
               "version": "1.0.0",
               "medallionLayer": "silver"
            },
            {
               "name": "jobFunction_jobFunctionText",
               "version": "1.0.0",
               "medallionLayer": "silver"
            }
         ]
      }
   ]
}