{
   "name": "JobRequisition",
   "namespace": "sap.sf.recruiting",
   "title": "JobRequisition",
   "shortDescription": "Data product that helps track job openings and also manage key details to streamline hiring, ensure compliance, and optimize workforce planning in an ATS.",
   "description": "Tracks job openings, managing key details to streamline hiring, ensure compliance, and optimize workforce planning in an ATS.",
   "version": "1.0.0",
   "extensible": {
      "supported": "automatic",
      "description": "Extensions to the model are automatically integrated in the API"
   },
   "hdlfsSchemas": [
      {
         "name": "JobRequisition",
         "shareTables": [
            {
               "name": "jobRequisition",
               "version": "1.0.0",
               "medallionLayer": "silver"
            },
            {
               "name": "jobRequisition_locationItem",
               "version": "1.0.0",
               "medallionLayer": "silver"
            },
            {
               "name": "jobRequisition_currencyData",
               "version": "1.0.0",
               "medallionLayer": "silver"
            },
            {
               "name": "jobRequisition_operator",
               "version": "1.0.0",
               "medallionLayer": "silver"
            },
            {
               "name": "jobRequisition_operatorTeam",
               "version": "1.0.0",
               "medallionLayer": "silver"
            },
            {
               "name": "jobRequisition_localizedText",
               "version": "1.0.0",
               "medallionLayer": "silver"
            },
            {
               "name": "jobRequisition_jobReqPostings",
               "version": "1.0.0",
               "medallionLayer": "silver"
            },
            {
               "name": "jobRequisition_Skills",
               "version": "1.0.0",
               "medallionLayer": "silver"
            },
            {
               "name": "jobRequisition_statusAudit",
               "version": "1.0.0",
               "medallionLayer": "silver"
            },
            {
               "name": "jobRequisition_skill",
               "version": "1.0.0",
               "medallionLayer": "silver"
            }
         ]
      }
   ]
}