{
   "name": "WorkforcePerson",
   "namespace": "sap.sf.workforce",
   "title": "WorkforcePerson",
   "shortDescription": "Workforce person contains data that refers to a person and their employment details.",
   "description": "Workforce person data refers to a person and their employment details. Workforce person data includes personal information,biographical information, address, contact information, national ID, social account, country/region-specific information, and employment details such as assignments, job details, and global assignment information.",
   "version": "1.0.0",
   "extensible": {
      "supported": "automatic",
      "description": "Extensions to the model are automatically integrated in the API"
   },
   "hdlfsSchemas": [
      {
         "name": "WorkforcePerson",
         "shareTables": [
            {
               "name": "person_personalDetail",
               "version": "1.0.0",
               "medallionLayer": "silver"
            },
            {
               "name": "person_assignment",
               "version": "1.0.0",
               "medallionLayer": "silver"
            },
            {
               "name": "person",
               "version": "1.0.0",
               "medallionLayer": "silver"
            },
            {
               "name": "person_biographicalLocDetail",
               "version": "1.0.0",
               "medallionLayer": "silver"
            },
            {
               "name": "person_biographicalDetail",
               "version": "1.0.0",
               "medallionLayer": "silver"
            },
            {
               "name": "person_nationalId",
               "version": "1.0.0",
               "medallionLayer": "silver"
            },
            {
               "name": "person_globalDetail",
               "version": "1.0.0",
               "medallionLayer": "silver"
            },
            {
               "name": "assignment_assignmentDetail",
               "version": "1.0.0",
               "medallionLayer": "silver"
            },
            {
               "name": "assignment",
               "version": "1.0.0",
               "medallionLayer": "silver"
            },
            {
               "name": "assignment_primaryAssignment",
               "version": "1.0.0",
               "medallionLayer": "silver"
            },
            {
               "name": "assignment_jobDetail",
               "version": "1.0.0",
               "medallionLayer": "silver"
            }
         ]
      }
   ]
}