{
   "name": "CommonConfigurationData",
   "namespace": "sap.sf.foundationobjects",
   "title": "CommonConfigurationData",
   "shortDescription": "Common configuration data is info that can be shared across the company, such as currency, country code, exchange rate, and time zone.",
   "description": "Common configuration data  is information that can be shared across the entire company, such as currencies, country codes, exchange rates, and time zones.",
   "version": "1.0.0",
   "extensible": {
      "supported": "automatic",
      "description": "Extensions to the model are automatically integrated in the API"
   },
   "hdlfsSchemas": [
      {
         "name": "CommonConfigurationData",
         "shareTables": [
            {
               "name": "currency",
               "version": "1.0.0",
               "medallionLayer": "silver"
            },
            {
               "name": "currency_currencyText",
               "version": "1.0.0",
               "medallionLayer": "silver"
            },
            {
               "name": "currency_currencyTimeSlice",
               "version": "1.0.0",
               "medallionLayer": "silver"
            },
            {
               "name": "country",
               "version": "1.0.0",
               "medallionLayer": "silver"
            },
            {
               "name": "country_countryTimeSlice",
               "version": "1.0.0",
               "medallionLayer": "silver"
            },
            {
               "name": "country_countryText",
               "version": "1.0.0",
               "medallionLayer": "silver"
            },
            {
               "name": "currencyExchangeRate_currencyExchangeRateText",
               "version": "1.0.0",
               "medallionLayer": "silver"
            },
            {
               "name": "currencyExchangeRate",
               "version": "1.0.0",
               "medallionLayer": "silver"
            },
            {
               "name": "currencyExchangeRate_currencyExchangeRateTimeSlice",
               "version": "1.0.0",
               "medallionLayer": "silver"
            },
            {
               "name": "timeZone_timeZoneText",
               "version": "1.0.0",
               "medallionLayer": "silver"
            },
            {
               "name": "timeZone",
               "version": "1.0.0",
               "medallionLayer": "silver"
            },
            {
               "name": "timeZone_timeZoneTimeSlice",
               "version": "1.0.0",
               "medallionLayer": "silver"
            },
            {
               "name": "geoZone",
               "version": "1.0.0",
               "medallionLayer": "silver"
            },
            {
               "name": "geoZone_geoZoneTimesliceText",
               "version": "1.0.0",
               "medallionLayer": "silver"
            },
            {
               "name": "geoZone_geoZoneTimeslice",
               "version": "1.0.0",
               "medallionLayer": "silver"
            },
            {
               "name": "frequency_frequencyText",
               "version": "1.0.0",
               "medallionLayer": "silver"
            },
            {
               "name": "frequency",
               "version": "1.0.0",
               "medallionLayer": "silver"
            },
            {
               "name": "eventReason",
               "version": "1.0.0",
               "medallionLayer": "silver"
            },
            {
               "name": "eventReason_eventReasonTimeslice",
               "version": "1.0.0",
               "medallionLayer": "silver"
            },
            {
               "name": "eventReason_eventReasonTimesliceText",
               "version": "1.0.0",
               "medallionLayer": "silver"
            }
         ]
      }
   ]
}