{
   "name": "JobApplication",
   "namespace": "sap.sf.recruiting",
   "title": "JobApplication",
   "shortDescription": "Data product that helps track and manage a candidate's application, monitoring progress, job details, and skills to streamline evaluation and hiring.",
   "description": "Tracks and manages a candidate's application, monitoring progress, job details, and skills to streamline evaluation and hiring.",
   "version": "1.0.0",
   "extensible": {
      "supported": "automatic",
      "description": "Extensions to the model are automatically integrated in the API"
   },
   "hdlfsSchemas": [
      {
         "name": "JobApplication",
         "shareTables": [
            {
               "name": "jobApplication",
               "version": "1.0.0",
               "medallionLayer": "silver"
            },
            {
               "name": "jobApplication_currencyData",
               "version": "1.0.0",
               "medallionLayer": "silver"
            },
            {
               "name": "jobApplication_questionResponse",
               "version": "1.0.0",
               "medallionLayer": "silver"
            },
            {
               "name": "jobApplication_comment",
               "version": "1.0.0",
               "medallionLayer": "silver"
            },
            {
               "name": "jobApplication_assessment",
               "version": "1.0.0",
               "medallionLayer": "silver"
            },
            {
               "name": "jobApplication_onboardingInformation",
               "version": "1.0.0",
               "medallionLayer": "silver"
            },
            {
               "name": "jobApplication_backgroundCheck",
               "version": "1.0.0",
               "medallionLayer": "silver"
            },
            {
               "name": "jobApplication_courses",
               "version": "1.0.0",
               "medallionLayer": "silver"
            },
            {
               "name": "jobApplication_certificates",
               "version": "1.0.0",
               "medallionLayer": "silver"
            },
            {
               "name": "jobApplication_mobility",
               "version": "1.0.0",
               "medallionLayer": "silver"
            },
            {
               "name": "jobApplication_languages",
               "version": "1.0.0",
               "medallionLayer": "silver"
            },
            {
               "name": "jobApplication_education",
               "version": "1.0.0",
               "medallionLayer": "silver"
            },
            {
               "name": "jobApplication_insideWorkExperience",
               "version": "1.0.0",
               "medallionLayer": "silver"
            },
            {
               "name": "jobApplication_outsideWorkExperience",
               "version": "1.0.0",
               "medallionLayer": "silver"
            },
            {
               "name": "jobApplication_statusAudit",
               "version": "1.0.0",
               "medallionLayer": "silver"
            },
            {
               "name": "jobApplication_skillProfile",
               "version": "1.0.0",
               "medallionLayer": "silver"
            },
            {
               "name": "jobApplication_skill",
               "version": "1.0.0",
               "medallionLayer": "silver"
            }
         ]
      }
   ]
}