{
   "name": "WorkforceCapability",
   "namespace": "sap.sf.capabilities",
   "title": "WorkforceCapability",
   "shortDescription": "This Data Product includes Attribute, Attribute Type, Proficiency Set, and Tag).",
   "description": "This Data Product in the Talent Intelligence Hub includes Attribute (a specific skill or other Attributes), Attribute Type (type of the attribute), Proficiency Set (levels of expertise), and Tag (contextual keywords for filtering and search)",
   "version": "1.0.0",
   "extensible": {
      "supported": "automatic",
      "description": "Extensions to the model are automatically integrated in the API"
   },
   "hdlfsSchemas": [
      {
         "name": "WorkforceCapability",
         "shareTables": [
            {
               "name": "library",
               "version": "1.0.0",
               "medallionLayer": "silver"
            },
            {
               "name": "library_source",
               "version": "1.0.0",
               "medallionLayer": "silver"
            },
            {
               "name": "library_libraryTypeRef",
               "version": "1.0.0",
               "medallionLayer": "silver"
            },
            {
               "name": "library_libraryText",
               "version": "1.0.0",
               "medallionLayer": "silver"
            },
            {
               "name": "library_tag",
               "version": "1.0.0",
               "medallionLayer": "silver"
            },
            {
               "name": "libraryType",
               "version": "1.0.0",
               "medallionLayer": "silver"
            },
            {
               "name": "libraryType_libraryTypeText",
               "version": "1.0.0",
               "medallionLayer": "silver"
            },
            {
               "name": "proficiencySet",
               "version": "1.0.0",
               "medallionLayer": "silver"
            },
            {
               "name": "proficiencySet_proficiencySetText",
               "version": "1.0.0",
               "medallionLayer": "silver"
            },
            {
               "name": "proficiencySet_proficiencyLevel",
               "version": "1.0.0",
               "medallionLayer": "silver"
            },
            {
               "name": "proficiencySet_proficiencyLevelText",
               "version": "1.0.0",
               "medallionLayer": "silver"
            },
            {
               "name": "tag",
               "version": "1.0.0",
               "medallionLayer": "silver"
            },
            {
               "name": "tag_tagText",
               "version": "1.0.0",
               "medallionLayer": "silver"
            }
         ]
      }
   ]
}