{
   "name": "Classification",
   "namespace": "sap.sf.learning",
   "title": "Classification",
   "shortDescription": "Contains reference data that is required in Learning.",
   "description": "Reference Data required in Learning",
   "version": "1.0.0",
   "extensible": {
      "supported": "automatic",
      "description": "Extensions to the model are automatically integrated in the API"
   },
   "hdlfsSchemas": [
      {
         "name": "Classification",
         "shareTables": [
            {
               "name": "classification_classificationText",
               "version": "1.0.0",
               "medallionLayer": "silver"
            },
            {
               "name": "classification",
               "version": "1.0.0",
               "medallionLayer": "silver"
            }
         ]
      }
   ]
}