{
    "name": "PersonInfo",
    "namespace": "sap.sf.analytics",
    "title": "Person Info",
    "shortDescription": "PersonInfo short description",
    "description": "PersonInfo description",
    "version": "1.0.0",
    "extensible": {
        "supported": "automatic",
        "description": "API can be extended by custom fields on the following business contexts"
    },
    "hdlfsSchemas": [
        {
            "name": "PersonInfo",
            "shareTables": [
                {
                    "name": "PersonInfo",
                    "version": "1.0.0",
                    "medallionLayer": "gold"
                }
            ]
        }
    ]
}