{
   "name": "Compensation",
   "namespace": "sap.sf.workforce",
   "title": "Compensation",
   "shortDescription": "Data Product for Compensation info of assignment includes compensation details and one-time payments.",
   "description": "Data Product that contains Compensation information of assignment includes compensation details and one-time payments.",
   "version": "1.0.0",
   "extensible": {
      "supported": "automatic",
      "description": "Extensions to the model are automatically integrated in the API"
   },
   "hdlfsSchemas": [
      {
         "name": "Compensation",
         "shareTables": [
            {
               "name": "oneTimePayment_oneTimePaymentDetail",
               "version": "1.0.0",
               "medallionLayer": "silver"
            },
            {
               "name": "oneTimePayment",
               "version": "1.0.0",
               "medallionLayer": "silver"
            },
            {
               "name": "compensationInfo",
               "version": "1.0.0",
               "medallionLayer": "silver"
            },
            {
               "name": "compensationInfo_compDetail",
               "version": "1.0.0",
               "medallionLayer": "silver"
            },
            {
               "name": "compensationInfo_recurringPayComponent",
               "version": "1.0.0",
               "medallionLayer": "silver"
            },
            {
               "name": "compensationInfo_targetPayComponent",
               "version": "1.0.0",
               "medallionLayer": "silver"
            }
         ]
      }
   ]
}