{
   "name": "Program",
   "namespace": "sap.sf.learning",
   "title": "Program",
   "shortDescription": "Includes all information for a Program. Delivery Date assumes that all the dependencies are in place.",
   "description": "Includes all information for a Program[Entity].Delivery Date assumes that all dependencies are in place. If this is not the case then Delivery Qtr will be re-determined",
   "version": "1.0.0",
   "extensible": {
      "supported": "automatic",
      "description": "Extensions to the model are automatically integrated in the API"
   },
   "hdlfsSchemas": [
      {
         "name": "Program",
         "shareTables": [
            {
               "name": "program",
               "version": "1.0.0",
               "medallionLayer": "silver"
            },
            {
               "name": "program_capabilityRating",
               "version": "1.0.0",
               "medallionLayer": "silver"
            },
            {
               "name": "program_learningItemText",
               "version": "1.0.0",
               "medallionLayer": "silver"
            },
            {
               "name": "program_categories",
               "version": "1.0.0",
               "medallionLayer": "silver"
            }
         ]
      }
   ]
}