{
   "name": "CompletionStatus",
   "namespace": "sap.sf.learning",
   "title": "CompletionStatus",
   "shortDescription": "Reference data that is required in Learning.",
   "description": "Reference Data required in Learning.",
   "version": "1.0.0",
   "extensible": {
      "supported": "automatic",
      "description": "Extensions to the model are automatically integrated in the API"
   },
   "hdlfsSchemas": [
      {
         "name": "CompletionStatus",
         "shareTables": [
            {
               "name": "completionStatus_completionStatusText",
               "version": "1.0.0",
               "medallionLayer": "silver"
            },
            {
               "name": "completionStatus",
               "version": "1.0.0",
               "medallionLayer": "silver"
            }
         ]
      }
   ]
}